{
  "schema_version": 1,
  "kind": "pandoc",
  "job_id": "7e125413aa417d3a",
  "writer": "docx",
  "argv": [
    "pandoc",
    "-f",
    "json",
    "-t",
    "docx",
    "--data-dir",
    "/__q2_share__/pandoc-share/pandoc/datadir",
    "-L",
    "/__q2_share__/pandoc-share/filters/main.lua",
    "--resource-path",
    "/project",
    "-o",
    "/project/doc.docx",
    "--default-image-extension",
    "png",
    "/__q2_share__/pandoc-input.json"
  ],
  "env": {
    "QUARTO_FILTER_DEPENDENCY_FILE": "/__q2_share__/pandoc-filter-deps.txt",
    "QUARTO_FILTER_PARAMS": "eyJhY3RpdmUtZmlsdGVycyI6eyJjcm9zc3JlZiI6dHJ1ZSwiamF0c19zdWJhcnRpY2xlIjpmYWxzZSwibm9ybWFsaXphdGlvbiI6dHJ1ZX0sImNyb3NzcmVmLWFweC1wcmVmaXgiOiJBcHBlbmRpeCIsImNyb3NzcmVmLWFweC10aXRsZSI6IkFwcGVuZGl4IiwiY3Jvc3NyZWYtY2F1LXByZWZpeCI6IkNhdXRpb24iLCJjcm9zc3JlZi1jYXUtdGl0bGUiOiJDYXV0aW9uIiwiY3Jvc3NyZWYtY2gtcHJlZml4IjoiQ2hhcHRlciIsImNyb3NzcmVmLWNoLXRpdGxlIjoiQ2hhcHRlciIsImNyb3NzcmVmLWNuai1wcmVmaXgiOiJDb25qZWN0dXJlIiwiY3Jvc3NyZWYtY25qLXRpdGxlIjoiQ29uamVjdHVyZSIsImNyb3NzcmVmLWNvci1wcmVmaXgiOiJDb3JvbGxhcnkiLCJjcm9zc3JlZi1jb3ItdGl0bGUiOiJDb3JvbGxhcnkiLCJjcm9zc3JlZi1kZWYtcHJlZml4IjoiRGVmaW5pdGlvbiIsImNyb3NzcmVmLWRlZi10aXRsZSI6IkRlZmluaXRpb24iLCJjcm9zc3JlZi1kZW1vLXByZWZpeCI6IkRlbW8iLCJjcm9zc3JlZi1kZW1vLXRpdGxlIjoiRGVtbyIsImNyb3NzcmVmLWVxLXByZWZpeCI6IkVxdWF0aW9uIiwiY3Jvc3NyZWYtZXEtdGl0bGUiOiJFcXVhdGlvbiIsImNyb3NzcmVmLWV4bS1wcmVmaXgiOiJFeGFtcGxlIiwiY3Jvc3NyZWYtZXhtLXRpdGxlIjoiRXhhbXBsZSIsImNyb3NzcmVmLWV4ci1wcmVmaXgiOiJFeGVyY2lzZSIsImNyb3NzcmVmLWV4ci10aXRsZSI6IkV4ZXJjaXNlIiwiY3Jvc3NyZWYtZmlnLXByZWZpeCI6IkZpZ3VyZSIsImNyb3NzcmVmLWZpZy10aXRsZSI6IkZpZ3VyZSIsImNyb3NzcmVmLWltcC1wcmVmaXgiOiJJbXBvcnRhbnQiLCJjcm9zc3JlZi1pbXAtdGl0bGUiOiJJbXBvcnRhbnQiLCJjcm9zc3JlZi1sZW0tcHJlZml4IjoiTGVtbWEiLCJjcm9zc3JlZi1sZW0tdGl0bGUiOiJMZW1tYSIsImNyb3NzcmVmLWxzdC1wcmVmaXgiOiJMaXN0aW5nIiwiY3Jvc3NyZWYtbHN0LXRpdGxlIjoiTGlzdGluZyIsImNyb3NzcmVmLW50ZS1wcmVmaXgiOiJOb3RlIiwiY3Jvc3NyZWYtbnRlLXRpdGxlIjoiTm90ZSIsImNyb3NzcmVmLW51bWJlcmluZyI6ImV4dGVybmFsIiwiY3Jvc3NyZWYtcHJwLXByZWZpeCI6IlByb3Bvc2l0aW9uIiwiY3Jvc3NyZWYtcHJwLXRpdGxlIjoiUHJvcG9zaXRpb24iLCJjcm9zc3JlZi1yZW0tcHJlZml4IjoiUmVtYXJrIiwiY3Jvc3NyZWYtcmVtLXRpdGxlIjoiUmVtYXJrIiwiY3Jvc3NyZWYtc2VjLXByZWZpeCI6IlNlY3Rpb24iLCJjcm9zc3JlZi1zZWMtdGl0bGUiOiJTZWN0aW9uIiwiY3Jvc3NyZWYtc29sLXByZWZpeCI6IlNvbHV0aW9uIiwiY3Jvc3NyZWYtc29sLXRpdGxlIjoiU29sdXRpb24iLCJjcm9zc3JlZi10YmwtcHJlZml4IjoiVGFibGUiLCJjcm9zc3JlZi10YmwtdGl0bGUiOiJUYWJsZSIsImNyb3NzcmVmLXRobS1wcmVmaXgiOiJUaGVvcmVtIiwiY3Jvc3NyZWYtdGhtLXRpdGxlIjoiVGhlb3JlbSIsImNyb3NzcmVmLXRpcC1wcmVmaXgiOiJUaXAiLCJjcm9zc3JlZi10aXAtdGl0bGUiOiJUaXAiLCJjcm9zc3JlZi13cm4tcHJlZml4IjoiV2FybmluZyIsImNyb3NzcmVmLXdybi10aXRsZSI6Ildhcm5pbmciLCJlbmFibGUtY3Jvc3NyZWYiOnRydWUsImV4ZWN1dGlvbi1lbmdpbmUiOiJtYXJrZG93biIsImZvcm1hdC1pZGVudGlmaWVyIjp7ImJhc2UtZm9ybWF0IjoiZG9jeCIsInRhcmdldC1mb3JtYXQiOiJkb2N4In0sImljb24tY2F1dGlvbiI6Ii9fX3EyX3NoYXJlX18vcGFuZG9jLXNoYXJlL2Zvcm1hdHMvZG9jeC9jYXV0aW9uLnBuZyIsImljb24taW1wb3J0YW50IjoiL19fcTJfc2hhcmVfXy9wYW5kb2Mtc2hhcmUvZm9ybWF0cy9kb2N4L2ltcG9ydGFudC5wbmciLCJpY29uLW5vdGUiOiIvX19xMl9zaGFyZV9fL3BhbmRvYy1zaGFyZS9mb3JtYXRzL2RvY3gvbm90ZS5wbmciLCJpY29uLXRpcCI6Ii9fX3EyX3NoYXJlX18vcGFuZG9jLXNoYXJlL2Zvcm1hdHMvZG9jeC90aXAucG5nIiwiaWNvbi13YXJuaW5nIjoiL19fcTJfc2hhcmVfXy9wYW5kb2Mtc2hhcmUvZm9ybWF0cy9kb2N4L3dhcm5pbmcucG5nIiwibGFuZ3VhZ2UiOnsiYXBwZW5kaXgtYXR0cmlidXRpb24tYmlidGV4IjoiQmliVGVYIGNpdGF0aW9uOiIsImFwcGVuZGl4LWF0dHJpYnV0aW9uLWNpdGUtYXMiOiJGb3IgYXR0cmlidXRpb24sIHBsZWFzZSBjaXRlIHRoaXMgd29yayBhczoiLCJhcHBlbmRpeC12aWV3LWxpY2Vuc2UiOiJWaWV3IExpY2Vuc2UiLCJhcnRpY2xlLW5vdGVib29rLWxhYmVsIjoiQXJ0aWNsZSBOb3RlYm9vayIsImJhY2stdG8tdG9wIjoiQmFjayB0byB0b3AiLCJjYWxsb3V0LWNhdXRpb24tdGl0bGUiOiJDYXV0aW9uIiwiY2FsbG91dC1pbXBvcnRhbnQtdGl0bGUiOiJJbXBvcnRhbnQiLCJjYWxsb3V0LW5vdGUtdGl0bGUiOiJOb3RlIiwiY2FsbG91dC10aXAtdGl0bGUiOiJUaXAiLCJjYWxsb3V0LXdhcm5pbmctdGl0bGUiOiJXYXJuaW5nIiwiY29kZS1saW5lIjoiTGluZSIsImNvZGUtbGluZXMiOiJMaW5lcyIsImNvZGUtbGlua3MtdGl0bGUiOiJDb2RlIExpbmtzIiwiY29kZS1zdW1tYXJ5IjoiQ29kZSIsImNvZGUtdG9vbHMtaGlkZS1hbGwtY29kZSI6IkhpZGUgQWxsIENvZGUiLCJjb2RlLXRvb2xzLW1lbnUtY2FwdGlvbiI6IkNvZGUiLCJjb2RlLXRvb2xzLXNob3ctYWxsLWNvZGUiOiJTaG93IEFsbCBDb2RlIiwiY29kZS10b29scy1zb3VyY2UtY29kZSI6IlNvdXJjZSBDb2RlIiwiY29kZS10b29scy12aWV3LXNvdXJjZSI6IlZpZXcgU291cmNlIiwiY29weS1idXR0b24tdG9vbHRpcCI6IkNvcHkgdG8gQ2xpcGJvYXJkIiwiY29weS1idXR0b24tdG9vbHRpcC1zdWNjZXNzIjoiQ29waWVkISIsImNyb3NzcmVmLWFweC1wcmVmaXgiOiJBcHBlbmRpeCIsImNyb3NzcmVmLWNoLXByZWZpeCI6IkNoYXB0ZXIiLCJjcm9zc3JlZi1jbmotdGl0bGUiOiJDb25qZWN0dXJlIiwiY3Jvc3NyZWYtY29yLXRpdGxlIjoiQ29yb2xsYXJ5IiwiY3Jvc3NyZWYtZGVmLXRpdGxlIjoiRGVmaW5pdGlvbiIsImNyb3NzcmVmLWVxLXByZWZpeCI6IkVxdWF0aW9uIiwiY3Jvc3NyZWYtZXhtLXRpdGxlIjoiRXhhbXBsZSIsImNyb3NzcmVmLWV4ci10aXRsZSI6IkV4ZXJjaXNlIiwiY3Jvc3NyZWYtZmlnLXRpdGxlIjoiRmlndXJlIiwiY3Jvc3NyZWYtbGVtLXRpdGxlIjoiTGVtbWEiLCJjcm9zc3JlZi1sb2YtdGl0bGUiOiJMaXN0IG9mIEZpZ3VyZXMiLCJjcm9zc3JlZi1sb2wtdGl0bGUiOiJMaXN0IG9mIExpc3RpbmdzIiwiY3Jvc3NyZWYtbG90LXRpdGxlIjoiTGlzdCBvZiBUYWJsZXMiLCJjcm9zc3JlZi1sc3QtdGl0bGUiOiJMaXN0aW5nIiwiY3Jvc3NyZWYtcHJwLXRpdGxlIjoiUHJvcG9zaXRpb24iLCJjcm9zc3JlZi1zZWMtcHJlZml4IjoiU2VjdGlvbiIsImNyb3NzcmVmLXRibC10aXRsZSI6IlRhYmxlIiwiY3Jvc3NyZWYtdGhtLXRpdGxlIjoiVGhlb3JlbSIsImRyYWZ0IjoiRHJhZnQiLCJlbnZpcm9ubWVudC1wcm9vZi10aXRsZSI6IlByb29mIiwiZW52aXJvbm1lbnQtcmVtYXJrLXRpdGxlIjoiUmVtYXJrIiwiZW52aXJvbm1lbnQtc29sdXRpb24tdGl0bGUiOiJTb2x1dGlvbiIsImxhdW5jaC1iaW5kZXItdGl0bGUiOiJMYXVuY2ggQmluZGVyIiwibGF1bmNoLWRldi1jb250YWluZXItdGl0bGUiOiJMYXVuY2ggRGV2IENvbnRhaW5lciIsImxpc3RpbmctcGFnZS1jYXRlZ29yeS1hbGwiOiJBbGwiLCJsaXN0aW5nLXBhZ2UtZmllbGQtYXV0aG9yIjoiQXV0aG9yIiwibGlzdGluZy1wYWdlLWZpZWxkLWNhdGVnb3JpZXMiOiJDYXRlZ29yaWVzIiwibGlzdGluZy1wYWdlLWZpZWxkLWRhdGUiOiJEYXRlIiwibGlzdGluZy1wYWdlLWZpZWxkLWRlc2NyaXB0aW9uIjoiRGVzY3JpcHRpb24iLCJsaXN0aW5nLXBhZ2UtZmllbGQtZmlsZW1vZGlmaWVkIjoiTW9kaWZpZWQiLCJsaXN0aW5nLXBhZ2UtZmllbGQtZmlsZW5hbWUiOiJGaWxlIE5hbWUiLCJsaXN0aW5nLXBhZ2UtZmllbGQtcmVhZGluZ3RpbWUiOiJSZWFkaW5nIFRpbWUiLCJsaXN0aW5nLXBhZ2UtZmllbGQtc3VidGl0bGUiOiJTdWJ0aXRsZSIsImxpc3RpbmctcGFnZS1maWVsZC10aXRsZSI6IlRpdGxlIiwibGlzdGluZy1wYWdlLWZpZWxkLXdvcmRjb3VudCI6IldvcmQgQ291bnQiLCJsaXN0aW5nLXBhZ2UtZmlsdGVyIjoiRmlsdGVyIiwibGlzdGluZy1wYWdlLW1pbnV0ZXMtY29tcGFjdCI6InswfSBtaW4iLCJsaXN0aW5nLXBhZ2Utbm8tbWF0Y2hlcyI6Ik5vIG1hdGNoaW5nIGl0ZW1zIiwibGlzdGluZy1wYWdlLW9yZGVyLWJ5IjoiT3JkZXIgQnkiLCJsaXN0aW5nLXBhZ2Utb3JkZXItYnktZGF0ZS1hc2MiOiJPbGRlc3QiLCJsaXN0aW5nLXBhZ2Utb3JkZXItYnktZGF0ZS1kZXNjIjoiTmV3ZXN0IiwibGlzdGluZy1wYWdlLW9yZGVyLWJ5LWRlZmF1bHQiOiJEZWZhdWx0IiwibGlzdGluZy1wYWdlLW9yZGVyLWJ5LW51bWJlci1hc2MiOiJMb3cgdG8gSGlnaCIsImxpc3RpbmctcGFnZS1vcmRlci1ieS1udW1iZXItZGVzYyI6IkhpZ2ggdG8gTG93IiwibGlzdGluZy1wYWdlLXdvcmRzIjoiezB9IHdvcmRzIiwibWFudXNjcmlwdC1tZWNhLWJ1bmRsZSI6Ik1FQ0EgQnVuZGxlIiwibm90ZWJvb2stcHJldmlldy1iYWNrIjoiQmFjayB0byBBcnRpY2xlIiwibm90ZWJvb2stcHJldmlldy1kb3dubG9hZCI6IkRvd25sb2FkIE5vdGVib29rIiwibm90ZWJvb2stcHJldmlldy1kb3dubG9hZC1zcmMiOiJEb3dubG9hZCBTb3VyY2UiLCJvdGhlci1saW5rcy10aXRsZSI6Ik90aGVyIExpbmtzIiwicmVsYXRlZC1mb3JtYXRzLXRpdGxlIjoiT3RoZXIgRm9ybWF0cyIsInJlbGF0ZWQtbm90ZWJvb2tzLXRpdGxlIjoiTm90ZWJvb2tzIiwicmVwby1hY3Rpb24tbGlua3MtZWRpdCI6IkVkaXQgdGhpcyBwYWdlIiwicmVwby1hY3Rpb24tbGlua3MtaXNzdWUiOiJSZXBvcnQgYW4gaXNzdWUiLCJyZXBvLWFjdGlvbi1saW5rcy1zb3VyY2UiOiJWaWV3IHNvdXJjZSIsInNlYXJjaC1jbGVhci1idXR0b24tdGl0bGUiOiJDbGVhciIsInNlYXJjaC1jb3B5LWxpbmstdGl0bGUiOiJDb3B5IGxpbmsgdG8gc2VhcmNoIiwic2VhcmNoLWRldGFjaGVkLWNhbmNlbC1idXR0b24tdGl0bGUiOiJDYW5jZWwiLCJzZWFyY2gtaGlkZS1tYXRjaGVzLXRleHQiOiJIaWRlIGFkZGl0aW9uYWwgbWF0Y2hlcyIsInNlYXJjaC1sYWJlbCI6IlNlYXJjaCIsInNlYXJjaC1tYXRjaGluZy1kb2N1bWVudHMtdGV4dCI6Im1hdGNoaW5nIGRvY3VtZW50cyIsInNlYXJjaC1tb3JlLW1hdGNoLXRleHQiOiJtb3JlIG1hdGNoIGluIHRoaXMgZG9jdW1lbnQiLCJzZWFyY2gtbW9yZS1tYXRjaGVzLXRleHQiOiJtb3JlIG1hdGNoZXMgaW4gdGhpcyBkb2N1bWVudCIsInNlYXJjaC1uby1yZXN1bHRzLXRleHQiOiJObyByZXN1bHRzIiwic2VhcmNoLXN1Ym1pdC1idXR0b24tdGl0bGUiOiJTdWJtaXQiLCJzZWFyY2gtdGV4dC1wbGFjZWhvbGRlciI6IiIsInNlY3Rpb24tdGl0bGUtYWJzdHJhY3QiOiJBYnN0cmFjdCIsInNlY3Rpb24tdGl0bGUtYXBwZW5kaWNlcyI6IkFwcGVuZGljZXMiLCJzZWN0aW9uLXRpdGxlLWNpdGF0aW9uIjoiQ2l0YXRpb24iLCJzZWN0aW9uLXRpdGxlLWNvcHlyaWdodCI6IkNvcHlyaWdodCIsInNlY3Rpb24tdGl0bGUtZm9vdG5vdGVzIjoiRm9vdG5vdGVzIiwic2VjdGlvbi10aXRsZS1yZWZlcmVuY2VzIjoiUmVmZXJlbmNlcyIsInNlY3Rpb24tdGl0bGUtcmV1c2UiOiJSZXVzZSIsInNvdXJjZS1ub3RlYm9va3MtcHJlZml4IjoiU291cmNlIiwidGl0bGUtYmxvY2stYWZmaWxpYXRpb24tcGx1cmFsIjoiQWZmaWxpYXRpb25zIiwidGl0bGUtYmxvY2stYWZmaWxpYXRpb24tc2luZ2xlIjoiQWZmaWxpYXRpb24iLCJ0aXRsZS1ibG9jay1hdXRob3ItcGx1cmFsIjoiQXV0aG9ycyIsInRpdGxlLWJsb2NrLWF1dGhvci1zaW5nbGUiOiJBdXRob3IiLCJ0aXRsZS1ibG9jay1rZXl3b3JkcyI6IktleXdvcmRzIiwidGl0bGUtYmxvY2stbW9kaWZpZWQiOiJNb2RpZmllZCIsInRpdGxlLWJsb2NrLXB1Ymxpc2hlZCI6IlB1Ymxpc2hlZCIsInRvYy10aXRsZS1kb2N1bWVudCI6IlRhYmxlIG9mIGNvbnRlbnRzIiwidG9jLXRpdGxlLXdlYnNpdGUiOiJPbiB0aGlzIHBhZ2UiLCJ0b2dnbGUtZGFyay1tb2RlIjoiVG9nZ2xlIGRhcmsgbW9kZSIsInRvZ2dsZS1uYXZpZ2F0aW9uIjoiVG9nZ2xlIG5hdmlnYXRpb24iLCJ0b2dnbGUtcmVhZGVyLW1vZGUiOiJUb2dnbGUgcmVhZGVyIG1vZGUiLCJ0b2dnbGUtc2VjdGlvbiI6IlRvZ2dsZSBzZWN0aW9uIiwidG9nZ2xlLXNpZGViYXIiOiJUb2dnbGUgc2lkZWJhciBuYXZpZ2F0aW9uIiwidG9vbHMtZG93bmxvYWQiOiJEb3dubG9hZCIsInRvb2xzLXNoYXJlIjoiU2hhcmUifSwibWVkaWFiYWctZGlyIjoiL3Byb2plY3QvZG9jX2ZpbGVzL21lZGlhYmFnIiwibnVtYmVyLWRlcHRoIjo2LCJudW1iZXItb2Zmc2V0IjpbXSwibnVtYmVyLXNlY3Rpb25zIjpmYWxzZSwib3V0cHV0LWRpdnMiOnRydWUsInBhZ2Utd2lkdGgiOjYuNSwicXVhcnRvLWVudmlyb25tZW50Ijp7InBhdGhzIjp7IlJzY3JpcHQiOiIiLCJUaW55VGV4QmluRGlyIjoiIiwiVHlwc3QiOiIifX0sInF1YXJ0by1maWx0ZXJzIjp7ImVudHJ5UG9pbnRzIjpbXX0sInJlc3VsdHMtZmlsZSI6Ii9fX3EyX3NoYXJlX18vcGFuZG9jLXJlc3VsdHMuanNvbiJ9",
    "QUARTO_SHARE_PATH": "/__q2_share__/pandoc-share",
    "SOURCE_DATE_EPOCH": "1700000000"
  },
  "files": [
    {
      "path": "/__q2_share__/pandoc-input.json",